{
  "schema_version": "0.1",
  "ruleset_version": "0.1.0",
  "catalog_version": "2026-08-15.1",
  "requirement": {
    "name": "rw-023"
  },
  "portfolio_verdict": "FAIL",
  "mission_results": [
    {
      "mission_id": "sentinel-2",
      "verdict": "FAIL",
      "findings": [
        {
          "code": "EFL201",
          "effect": "FAIL",
          "title": "Required modality unavailable",
          "message": "The mission does not provide the thermal_ir modality implied by the spatial.thermal_max_gsd_m requirement.",
          "required": {
            "modality": "thermal_ir",
            "implied_by": "spatial.thermal_max_gsd_m"
          },
          "capability": {
            "modalities": [
              "optical_multispectral"
            ]
          },
          "source_ids": [
            "esa-sentiwiki-s2-mission"
          ]
        },
        {
          "code": "EFL201",
          "effect": "FAIL",
          "title": "Required modality unavailable",
          "message": "The mission provides none of the required sensing modalities.",
          "required": {
            "modality_any_of": [
              "thermal_ir"
            ]
          },
          "capability": {
            "modalities": [
              "optical_multispectral"
            ]
          },
          "source_ids": [
            "esa-sentiwiki-s2-mission"
          ]
        },
        {
          "code": "EFL801",
          "effect": "CONDITIONAL",
          "title": "Derived processing required",
          "message": "The requested output is a derived product: processing beyond raw acquisition is required, and the mission specification alone cannot establish that it will succeed.",
          "required": {
            "output_kind": "derived_product"
          },
          "capability": {},
          "source_ids": []
        }
      ]
    },
    {
      "mission_id": "sentinel-1-iw",
      "verdict": "FAIL",
      "findings": [
        {
          "code": "EFL201",
          "effect": "FAIL",
          "title": "Required modality unavailable",
          "message": "The mission does not provide the thermal_ir modality implied by the spatial.thermal_max_gsd_m requirement.",
          "required": {
            "modality": "thermal_ir",
            "implied_by": "spatial.thermal_max_gsd_m"
          },
          "capability": {
            "modalities": [
              "sar_c_band"
            ]
          },
          "source_ids": [
            "esa-sentiwiki-s1-mission"
          ]
        },
        {
          "code": "EFL201",
          "effect": "FAIL",
          "title": "Required modality unavailable",
          "message": "The mission provides none of the required sensing modalities.",
          "required": {
            "modality_any_of": [
              "thermal_ir"
            ]
          },
          "capability": {
            "modalities": [
              "sar_c_band"
            ]
          },
          "source_ids": [
            "esa-sentiwiki-s1-mission"
          ]
        },
        {
          "code": "EFL801",
          "effect": "CONDITIONAL",
          "title": "Derived processing required",
          "message": "The requested output is a derived product: processing beyond raw acquisition is required, and the mission specification alone cannot establish that it will succeed.",
          "required": {
            "output_kind": "derived_product"
          },
          "capability": {},
          "source_ids": []
        }
      ]
    },
    {
      "mission_id": "landsat-8",
      "verdict": "FAIL",
      "findings": [
        {
          "code": "EFL302",
          "effect": "FAIL",
          "title": "Thermal GSD requirement unmet",
          "message": "The mission's thermal infrared ground sample distance is coarser than the requirement.",
          "required": {
            "thermal_max_gsd_m": 50
          },
          "capability": {
            "band_family": "thermal_ir",
            "resolution_m": 100
          },
          "source_ids": [
            "usgs-landsat-8"
          ]
        },
        {
          "code": "EFL801",
          "effect": "CONDITIONAL",
          "title": "Derived processing required",
          "message": "The requested output is a derived product: processing beyond raw acquisition is required, and the mission specification alone cannot establish that it will succeed.",
          "required": {
            "output_kind": "derived_product"
          },
          "capability": {},
          "source_ids": []
        }
      ]
    },
    {
      "mission_id": "landsat-9",
      "verdict": "FAIL",
      "findings": [
        {
          "code": "EFL302",
          "effect": "FAIL",
          "title": "Thermal GSD requirement unmet",
          "message": "The mission's thermal infrared ground sample distance is coarser than the requirement.",
          "required": {
            "thermal_max_gsd_m": 50
          },
          "capability": {
            "band_family": "thermal_ir",
            "resolution_m": 100
          },
          "source_ids": [
            "usgs-landsat-9"
          ]
        },
        {
          "code": "EFL801",
          "effect": "CONDITIONAL",
          "title": "Derived processing required",
          "message": "The requested output is a derived product: processing beyond raw acquisition is required, and the mission specification alone cannot establish that it will succeed.",
          "required": {
            "output_kind": "derived_product"
          },
          "capability": {},
          "source_ids": []
        }
      ]
    },
    {
      "mission_id": "landsat-8-9",
      "verdict": "FAIL",
      "findings": [
        {
          "code": "EFL302",
          "effect": "FAIL",
          "title": "Thermal GSD requirement unmet",
          "message": "The mission's thermal infrared ground sample distance is coarser than the requirement.",
          "required": {
            "thermal_max_gsd_m": 50
          },
          "capability": {
            "band_family": "thermal_ir",
            "resolution_m": 100
          },
          "source_ids": [
            "usgs-landsat-8",
            "usgs-landsat-9"
          ]
        },
        {
          "code": "EFL801",
          "effect": "CONDITIONAL",
          "title": "Derived processing required",
          "message": "The requested output is a derived product: processing beyond raw acquisition is required, and the mission specification alone cannot establish that it will succeed.",
          "required": {
            "output_kind": "derived_product"
          },
          "capability": {},
          "source_ids": []
        }
      ]
    }
  ]
}
