{
  "schema_version": "0.1",
  "ruleset_version": "0.1.0",
  "catalog_version": "2026-08-15.1",
  "requirement": {
    "name": "rw-026"
  },
  "portfolio_verdict": "CONDITIONAL",
  "mission_results": [
    {
      "mission_id": "sentinel-2",
      "verdict": "FAIL",
      "findings": [
        {
          "code": "EFL201",
          "effect": "FAIL",
          "title": "Required modality unavailable",
          "message": "The mission provides none of the required sensing modalities.",
          "required": {
            "modality_any_of": [
              "thermal_ir"
            ]
          },
          "capability": {
            "modalities": [
              "optical_multispectral"
            ]
          },
          "source_ids": [
            "esa-sentiwiki-s2-mission"
          ]
        },
        {
          "code": "EFL801",
          "effect": "CONDITIONAL",
          "title": "Derived processing required",
          "message": "The requested output is a derived product: processing beyond raw acquisition is required, and the mission specification alone cannot establish that it will succeed.",
          "required": {
            "output_kind": "derived_product"
          },
          "capability": {},
          "source_ids": []
        }
      ]
    },
    {
      "mission_id": "sentinel-1-iw",
      "verdict": "FAIL",
      "findings": [
        {
          "code": "EFL201",
          "effect": "FAIL",
          "title": "Required modality unavailable",
          "message": "The mission provides none of the required sensing modalities.",
          "required": {
            "modality_any_of": [
              "thermal_ir"
            ]
          },
          "capability": {
            "modalities": [
              "sar_c_band"
            ]
          },
          "source_ids": [
            "esa-sentiwiki-s1-mission"
          ]
        },
        {
          "code": "EFL801",
          "effect": "CONDITIONAL",
          "title": "Derived processing required",
          "message": "The requested output is a derived product: processing beyond raw acquisition is required, and the mission specification alone cannot establish that it will succeed.",
          "required": {
            "output_kind": "derived_product"
          },
          "capability": {},
          "source_ids": []
        }
      ]
    },
    {
      "mission_id": "landsat-8",
      "verdict": "CONDITIONAL",
      "findings": [
        {
          "code": "EFL502",
          "effect": "CONDITIONAL",
          "title": "Night operation conditional",
          "message": "Night acquisition with the thermal_ir band family is technically possible but is not treated as guaranteed nominal availability.",
          "required": {
            "must_support_night": true,
            "band_families": [
              "thermal_ir"
            ],
            "selection": "any_of"
          },
          "capability": {
            "band_family": "thermal_ir",
            "night_support": "occasional"
          },
          "source_ids": [
            "usgs-landsat-acquisition-schedules",
            "usgs-landsat-acquisition-plan"
          ]
        },
        {
          "code": "EFL801",
          "effect": "CONDITIONAL",
          "title": "Derived processing required",
          "message": "The requested output is a derived product: processing beyond raw acquisition is required, and the mission specification alone cannot establish that it will succeed.",
          "required": {
            "output_kind": "derived_product"
          },
          "capability": {},
          "source_ids": []
        }
      ]
    },
    {
      "mission_id": "landsat-9",
      "verdict": "CONDITIONAL",
      "findings": [
        {
          "code": "EFL502",
          "effect": "CONDITIONAL",
          "title": "Night operation conditional",
          "message": "Night acquisition with the thermal_ir band family is technically possible but is not treated as guaranteed nominal availability.",
          "required": {
            "must_support_night": true,
            "band_families": [
              "thermal_ir"
            ],
            "selection": "any_of"
          },
          "capability": {
            "band_family": "thermal_ir",
            "night_support": "occasional"
          },
          "source_ids": [
            "usgs-landsat-acquisition-schedules",
            "usgs-landsat-acquisition-plan"
          ]
        },
        {
          "code": "EFL801",
          "effect": "CONDITIONAL",
          "title": "Derived processing required",
          "message": "The requested output is a derived product: processing beyond raw acquisition is required, and the mission specification alone cannot establish that it will succeed.",
          "required": {
            "output_kind": "derived_product"
          },
          "capability": {},
          "source_ids": []
        }
      ]
    },
    {
      "mission_id": "landsat-8-9",
      "verdict": "CONDITIONAL",
      "findings": [
        {
          "code": "EFL502",
          "effect": "CONDITIONAL",
          "title": "Night operation conditional",
          "message": "Night acquisition with the thermal_ir band family is technically possible but is not treated as guaranteed nominal availability.",
          "required": {
            "must_support_night": true,
            "band_families": [
              "thermal_ir"
            ],
            "selection": "any_of"
          },
          "capability": {
            "band_family": "thermal_ir",
            "night_support": "occasional"
          },
          "source_ids": [
            "usgs-landsat-acquisition-schedules",
            "usgs-landsat-acquisition-plan"
          ]
        },
        {
          "code": "EFL801",
          "effect": "CONDITIONAL",
          "title": "Derived processing required",
          "message": "The requested output is a derived product: processing beyond raw acquisition is required, and the mission specification alone cannot establish that it will succeed.",
          "required": {
            "output_kind": "derived_product"
          },
          "capability": {},
          "source_ids": []
        }
      ]
    }
  ]
}
