{
  "schema_version": "0.1",
  "ruleset_version": "0.1.0",
  "catalog_version": "2026-08-15.1",
  "requirement": {
    "name": "rw-004"
  },
  "portfolio_verdict": "CONDITIONAL",
  "mission_results": [
    {
      "mission_id": "sentinel-2",
      "verdict": "FAIL",
      "findings": [
        {
          "code": "EFL201",
          "effect": "FAIL",
          "title": "Required modality unavailable",
          "message": "The mission provides none of the required sensing modalities.",
          "required": {
            "modality_any_of": [
              "sar_c_band"
            ]
          },
          "capability": {
            "modalities": [
              "optical_multispectral"
            ]
          },
          "source_ids": [
            "esa-sentiwiki-s2-mission"
          ]
        },
        {
          "code": "EFL802",
          "effect": "CONDITIONAL",
          "title": "Model validation required",
          "message": "A model is required to produce the requested output. Mission specifications alone cannot validate that model.",
          "required": {
            "output_kind": "model_inference"
          },
          "capability": {},
          "source_ids": []
        }
      ]
    },
    {
      "mission_id": "sentinel-1-iw",
      "verdict": "CONDITIONAL",
      "findings": [
        {
          "code": "EFL802",
          "effect": "CONDITIONAL",
          "title": "Model validation required",
          "message": "A model is required to produce the requested output. Mission specifications alone cannot validate that model.",
          "required": {
            "output_kind": "model_inference"
          },
          "capability": {},
          "source_ids": []
        }
      ]
    },
    {
      "mission_id": "landsat-8",
      "verdict": "FAIL",
      "findings": [
        {
          "code": "EFL201",
          "effect": "FAIL",
          "title": "Required modality unavailable",
          "message": "The mission provides none of the required sensing modalities.",
          "required": {
            "modality_any_of": [
              "sar_c_band"
            ]
          },
          "capability": {
            "modalities": [
              "optical_multispectral",
              "thermal_ir"
            ]
          },
          "source_ids": [
            "usgs-landsat-8"
          ]
        },
        {
          "code": "EFL802",
          "effect": "CONDITIONAL",
          "title": "Model validation required",
          "message": "A model is required to produce the requested output. Mission specifications alone cannot validate that model.",
          "required": {
            "output_kind": "model_inference"
          },
          "capability": {},
          "source_ids": []
        }
      ]
    },
    {
      "mission_id": "landsat-9",
      "verdict": "FAIL",
      "findings": [
        {
          "code": "EFL201",
          "effect": "FAIL",
          "title": "Required modality unavailable",
          "message": "The mission provides none of the required sensing modalities.",
          "required": {
            "modality_any_of": [
              "sar_c_band"
            ]
          },
          "capability": {
            "modalities": [
              "optical_multispectral",
              "thermal_ir"
            ]
          },
          "source_ids": [
            "usgs-landsat-9"
          ]
        },
        {
          "code": "EFL802",
          "effect": "CONDITIONAL",
          "title": "Model validation required",
          "message": "A model is required to produce the requested output. Mission specifications alone cannot validate that model.",
          "required": {
            "output_kind": "model_inference"
          },
          "capability": {},
          "source_ids": []
        }
      ]
    },
    {
      "mission_id": "landsat-8-9",
      "verdict": "FAIL",
      "findings": [
        {
          "code": "EFL201",
          "effect": "FAIL",
          "title": "Required modality unavailable",
          "message": "The mission provides none of the required sensing modalities.",
          "required": {
            "modality_any_of": [
              "sar_c_band"
            ]
          },
          "capability": {
            "modalities": [
              "optical_multispectral",
              "thermal_ir"
            ]
          },
          "source_ids": [
            "usgs-landsat-8",
            "usgs-landsat-9"
          ]
        },
        {
          "code": "EFL802",
          "effect": "CONDITIONAL",
          "title": "Model validation required",
          "message": "A model is required to produce the requested output. Mission specifications alone cannot validate that model.",
          "required": {
            "output_kind": "model_inference"
          },
          "capability": {},
          "source_ids": []
        }
      ]
    }
  ]
}
