{
  "schema_version": "0.1",
  "ruleset_version": "0.1.0",
  "catalog_version": "2026-08-15.1",
  "requirement": {
    "name": "rw-029"
  },
  "portfolio_verdict": "PASS",
  "mission_results": [
    {
      "mission_id": "sentinel-2",
      "verdict": "PASS",
      "findings": []
    },
    {
      "mission_id": "sentinel-1-iw",
      "verdict": "FAIL",
      "findings": [
        {
          "code": "EFL201",
          "effect": "FAIL",
          "title": "Required modality unavailable",
          "message": "The mission does not provide the optical_multispectral modality implied by the spatial.optical_max_gsd_m requirement.",
          "required": {
            "modality": "optical_multispectral",
            "implied_by": "spatial.optical_max_gsd_m"
          },
          "capability": {
            "modalities": [
              "sar_c_band"
            ]
          },
          "source_ids": [
            "esa-sentiwiki-s1-mission"
          ]
        },
        {
          "code": "EFL202",
          "effect": "FAIL",
          "title": "Required spectral band family unavailable",
          "message": "The mission does not provide the nir band family.",
          "required": {
            "spectral_band_family": "nir"
          },
          "capability": {
            "band_family": "nir",
            "available": false
          },
          "source_ids": [
            "esa-sentiwiki-s1-mission",
            "esa-sentiwiki-s1-products"
          ]
        },
        {
          "code": "EFL202",
          "effect": "FAIL",
          "title": "Required spectral band family unavailable",
          "message": "The mission does not provide the swir band family.",
          "required": {
            "spectral_band_family": "swir"
          },
          "capability": {
            "band_family": "swir",
            "available": false
          },
          "source_ids": [
            "esa-sentiwiki-s1-mission",
            "esa-sentiwiki-s1-products"
          ]
        },
        {
          "code": "EFL202",
          "effect": "FAIL",
          "title": "Required spectral band family unavailable",
          "message": "The mission does not provide the visible band family.",
          "required": {
            "spectral_band_family": "visible"
          },
          "capability": {
            "band_family": "visible",
            "available": false
          },
          "source_ids": [
            "esa-sentiwiki-s1-mission",
            "esa-sentiwiki-s1-products"
          ]
        }
      ]
    },
    {
      "mission_id": "landsat-8",
      "verdict": "PASS",
      "findings": []
    },
    {
      "mission_id": "landsat-9",
      "verdict": "PASS",
      "findings": []
    },
    {
      "mission_id": "landsat-8-9",
      "verdict": "PASS",
      "findings": []
    }
  ]
}
